{
  "version": "1.0.0",
  "system": {
    "device_name": "MFDS-Display-Box-Pi4",
    "location": "Sảnh Văn Phòng Khoa KTMT",
    "banner_title": "BẢNG TIN ĐIỆN TỬ THÔNG MINH"
  },
  "notices": [
    {
      "id": 1,
      "title": "Hội nghị Nghiên cứu Khoa học & Công nghệ Nhúng",
      "content": "Kính mời toàn thể cán bộ và sinh viên tham dự buổi báo cáo chuyên đề Embedded Linux & Edge AI tại Hội trường A.",
      "priority": "urgent",
      "date": "2026-10-21",
      "active": true
    },
    {
      "id": 2,
      "title": "Thông báo Nộp Đề cương Đồ án Tốt nghiệp",
      "content": "Hạn chót nộp phiếu đăng ký đề cương chi tiết trước 17:00 ngày 25/10/2026 tại văn phòng khoa.",
      "priority": "normal",
      "date": "2026-10-20",
      "active": true
    },
    {
      "id": 3,
      "title": "Bảo trì Hệ thống Mạng Cuối tuần",
      "content": "Trung tâm dữ liệu sẽ tiến hành nâng cấp hạ tầng mạng cáp quang từ 22:00 Thứ Bảy đến 04:00 Chủ Nhật.",
      "priority": "info",
      "date": "2026-10-19",
      "active": true
    }
  ],
  "schedules": [
    {
      "id": 1,
      "time_slot": "08:00 - 09:30",
      "event_name": "Họp Giao ban Bộ môn Kỹ thuật Máy tính",
      "room": "Phòng B4.05",
      "host": "ThS. Phan Đình Duy"
    },
    {
      "id": 2,
      "time_slot": "09:45 - 11:30",
      "event_name": "Review Đồ án Hệ thống Nhúng & IoT",
      "room": "Phòng Lab E2.01",
      "host": "Nhóm Đồ án MFDS"
    },
    {
      "id": 3,
      "time_slot": "13:30 - 15:30",
      "event_name": "Bảo vệ Luận văn Thạc sĩ",
      "room": "Phòng Hội thảo C",
      "host": "Hội đồng Chuyên môn"
    },
    {
      "id": 4,
      "time_slot": "16:00 - 17:30",
      "event_name": "Thử nghiệm Kiosk Display Box Pi 4",
      "room": "Sảnh Văn phòng",
      "host": "Lê Phúc Tài & Võ Thanh Dũng"
    }
  ],
  "news_ticker": [
    "CHÀO MỪNG QUÝ THẦY CÔ VÀ SINH VIÊN ĐẾN VỚI VĂN PHÒNG KHOA KỸ THUẬT MÁY TÍNH",
    "THIẾT BỊ HỆ THỐNG HIỂN THỊ ĐA CHỨC NĂNG (MFDS) VẬN HÀNH TRÊN CUSTOM YOCTO LINUX EMBEDDED OS",
    "NHIỆT ĐỘ PHÒNG HIỆN TẠI: 26°C | ĐỘ ẨM: 65% | KẾT NỐI MẠNG LAN: 1000 MBPS (HOẠT ĐỘNG TỐT)"
  ]
}
